_id,Country,Price,Date,Duration,Description,ImageUrl
663241db4cc98671eadee199,Switzerland,3000.00,9/1/2024,7 days,"Immerse yourself in Switzerland's Alpine beauty. This tour includes flights, one meal daily, transportation, and hotel accommodations. Explore Interlaken, Lucerne, and Zermatt, enjoying activities like skiing and scenic hikes.",switz.jpg
663241db4cc98671eadee19a,Italy,2500.00,7/1/2024,7 days,"Italy's cultural treasures. This tour covers flights, one daily meal, transport, and hotel stays. Visit Rome's ancient ruins, admire Florence's art, and experience Venice's canals. Enjoy authentic Italian cuisine.",italy.jpg
663241db4cc98671eadee19b,Korea,1800.00,9/1/2024,7 days,"Discover South Korea on a comprehensive tour package with flights, accommodations, meals, and transportation included. Explore Seoul's vibrant streets, visit historic landmarks, and indulge in delicious Korean cuisine. Experience the natural beauty of Jeju Island and Seoraksan National Park.",korea.jpg
663241db4cc98671eadee19c,Egypt,2000.00,8/1/2024,9 days,"Uncover Egypt's ancient wonders. This tour includes flights, one meal daily, transport, and hotel stays. See the Pyramids of Giza, cruise the Nile, and visit Luxor's temples. Discover Egypt's history and vibrant culture.",egypt.jpg
663241db4cc98671eadee19d,Africa,3000.00,7/1/2024,7 days,"Experience an incredible safari adventure in Africa. This all-inclusive tour covers flights, daily meals, transport, and lodging. Explore Kenya's Maasai Mara or Tanzania's Serengeti National Park, encountering lions, elephants, and giraffes in the wild.",africa.jpg
663241db4cc98671eadee19e,Alaska,2500.00,9/1/2024,7 days,"Encounter Alaska's wilderness. This tour includes flights, one daily meal, transport, and lodging. Cruise the Inside Passage, witness glaciers in Glacier Bay, and spot wildlife in Denali. Experience outdoor activities in a pristine setting.",alaska.jpg
